{"apex_labs_source_commit":"UNCOMMITTED","apex_labs_version":"0.1.1","export_id":"synthetic-mechanics-demo-v1","finding_provenance":[{"analysis":{"algorithm_id":"demo-record-count","algorithm_version":"1.0.0","configuration":{"purpose":"mechanics_only"},"random_seed":null},"dataset_references":[{"dataset_id":"synthetic-mechanics-demo","fingerprint":"a9b4f5d73a005ffa7728328e0995d955986f8af6bda20a59392454ee5d4390bd","normalized_manifest_sha256":"f93d7d14496602f56072b6c7d455b1336c531640772c1cc6f1efc75d5b9120f9","records_sha256":"de125c35b2f1b62b31b82cd4044fc438a4289135d005fc8aea9c6a9a19a39832","synthetic":true}],"finding_id":"synthetic-mechanics-demo","finding_version":"1.0.0","preprocessing":{"configuration":{"normalized_dataset_fingerprint":"a9b4f5d73a005ffa7728328e0995d955986f8af6bda20a59392454ee5d4390bd","normalized_manifest_sha256":"f93d7d14496602f56072b6c7d455b1336c531640772c1cc6f1efc75d5b9120f9"},"configuration_sha256":"1835ea6edff1a1561260712afb3ece5050234194e710705595732d4c5c91f9b9","normalization_version":"1.1.0","pipeline_id":"tabular-csv-normalization","pipeline_version":"1.1.0"},"product_review_state":"not_requested","protocol_reference":{"experiment_id":"synthetic-mechanics-demo-protocol","freeze_id":"synthetic-mechanics-demo-protocol.freeze","freeze_sha256":"29bc942f4c7a24e38b28212a7b850e1487048a1b128c8077c13b74f9af2a8d0f","version":"1.0.0"},"scientific_review_state":"unresolved","validation_artifact_reference":{"validation_id":"synthetic-mechanics-demo-validation","version":"1.0.0"}}],"schema_version":"apex-labs.product-provenance-summary/v1"}
